{
  "compute": {
    "intermittent_contributors_supported": true,
    "maximum_download_bytes": 8589934592,
    "minimum_memory_bytes": 4294967296,
    "supported_devices": [
      "cpu",
      "cuda"
    ]
  },
  "content_hash": "sha256:0a2b65fc79bac8052b68dd2a0a7eb5b0ba2f86e42b5dc6c47be88f992336109f",
  "dataset": {
    "dataset_id": "Salesforce/wikitext",
    "dataset_snapshot_hash": "sha256:3b764bde8301a060f872901bf28d621d7a879e3bfe16553ff6a4ea2fe8d4c058",
    "licenses_spdx": [
      "CC-BY-SA-3.0",
      "GFDL-1.3-or-later"
    ],
    "personal_data_reviewed": true,
    "redistribution_allowed": true,
    "revision": "b08601e04326c79dfdd32d625aee71d232d685c3",
    "source_public": true
  },
  "evaluation": {
    "baseline_required": true,
    "heldout_split_hash": "sha256:c6bb82e43dae09d261c93bdc7a5eeecda1861794e9130ddc1d13b832dc0c824e",
    "metrics": [
      "validation_loss",
      "perplexity"
    ],
    "publish_before_after_results": true,
    "suite_id": "wikitext-heldout-v1"
  },
  "governance": {
    "conflict_disclosures_required": true,
    "decision_log_public": true,
    "governance_model": "named_maintainers",
    "maintainers": [
      "maintainer-a",
      "maintainer-b"
    ],
    "pause_and_rollback_owner": "maintainer-a"
  },
  "model": {
    "license_spdx": "Apache-2.0",
    "model_id": "HuggingFaceTB/SmolLM2-135M",
    "parameter_count": 134515008,
    "redistribution_allowed": true,
    "revision": "93efa2f097d58c2a74874c7e644dbc9b0cee75a2",
    "source_public": true
  },
  "proposal_id": "smollm2-wikitext-community-001",
  "publication": {
    "attribution_file_required": true,
    "audit_ledger_public": true,
    "campaign_manifest_public": true,
    "checkpoints_public": true,
    "evaluation_results_public": true,
    "result_license_spdx": "Apache-2.0"
  },
  "safety": {
    "allowed_use_summary": "Open research and reproducible language-model adaptation.",
    "moderation_owner": "maintainer-b",
    "permissionless_admission": false,
    "poisoning_safety_claimed": false,
    "prohibited_data_categories": [
      "private_credentials",
      "non-consensual_personal_data",
      "copyrighted_data_without_permission"
    ],
    "rollback_plan_public": true,
    "sybil_resistance_claimed": false
  },
  "schema": "crowdtensor_volunteer_campaign_proposal_v1",
  "summary": "A bounded public LoRA Campaign with immutable inputs and reproducible evaluation.",
  "title": "SmolLM2 WikiText community adaptation",
  "training": {
    "base_weights_frozen": true,
    "local_steps": 1,
    "maximum_update_bytes": 268435456,
    "method": "peft_lora",
    "minimum_quorum": 2,
    "sequence_length": 16,
    "target_rounds": 3
  }
}
